appID,name,release_date,price,supported_languages,developers,publishers,categories,genres,tags,metacriticScore
208480,Assassin’s Creed® III,"Nov 20, 2012",0.0,"['English', 'Czech', 'Danish', 'Dutch', 'Finnish', 'French', 'German', 'Hungarian', 'Italian', 'Norwegian', 'Polish', 'Portuguese - Portugal', 'Portuguese - Brazil', 'Russian', 'Spanish - Spain', 'Swedish', 'Traditional Chinese', 'Korean', 'Simplified Chinese']",Ubisoft Montreal,Ubisoft,"Single-player, Multi-player, Steam Achievements, Partial Controller Support",Adventure,"Adventure, Open World, Action, Assassin, Parkour, Stealth, Third Person, Historical, Multiplayer, America, Singleplayer, Story Rich, Hunting, Atmospheric, Action-Adventure, Sandbox, Alternate History, Conspiracy, Controller, 3D",80
464920,Surviving Mars,"Mar 15, 2018",0.0,"['English', 'French', 'German', 'Spanish - Spain', 'Polish', 'Portuguese - Brazil', 'Russian', 'Simplified Chinese', 'Turkish']","Haemimont Games, Abstraction",Paradox Interactive,"Single-player, Steam Achievements, Full controller support, Steam Trading Cards, Steam Workshop, Steam Cloud, Remote Play on TV, Family Sharing","Simulation, Strategy","Colony Sim, City Builder, Strategy, Survival, Space, Base-Building, Mars, Simulation, Sci-fi, Resource Management, Singleplayer, Building, Management, Sandbox, Space Sim, Futuristic, Open World, RTS, Great Soundtrack, Moddable",76
230410,Warframe,"Mar 25, 2013",0.0,"['English', 'German', 'French', 'Italian', 'Korean', 'Spanish - Spain', 'Simplified Chinese', 'Russian', 'Japanese', 'Polish', 'Portuguese - Brazil', 'Traditional Chinese', 'Turkish', 'Ukrainian', 'Thai']",Digital Extremes,Digital Extremes,"Single-player, Multi-player, Co-op, Online Co-op, Cross-Platform Multiplayer, Steam Achievements, Full controller support, Steam Trading Cards, Steam Workshop, In-App Purchases, Camera Comfort, Color Alternatives, Custom Volume Controls, Playable without Timed Input, Stereo Sound, Surround Sound, Remote Play on Phone, Remote Play on Tablet, Remote Play on TV, HDR available","Action, RPG, Free To Play","Free to Play, Action RPG, Looter Shooter, Third-Person Shooter, Action, RPG, Third Person, Character Customization, Massively Multiplayer, Online Co-Op, Co-op, PvE, Sci-fi, Singleplayer, Space, Shooter, Lore-Rich, Hack and Slash, Parkour, Ninja",69
3820,BloodRayne 2 (Legacy),"Sep 14, 2006",0.0,['English'],Terminal Reality,Ziggurat,"Single-player, Steam Trading Cards, Family Sharing",Action,"Action, Vampire, Female Protagonist, Gore, Hack and Slash, Third Person, Singleplayer, Horror, Classic, Nudity",67
716770,Exorder,"Mar 19, 2018",0.0,"['English', 'Polish', 'French', 'Italian', 'German', 'Spanish - Spain', 'Simplified Chinese', 'Traditional Chinese']",Solid9 Studio,No Gravity Games,"Single-player, Multi-player, PvP, Online PvP, Shared/Split Screen PvP, Steam Achievements, Full controller support, Remote Play Together, Family Sharing","Indie, Strategy","Turn-Based Tactics, Family Friendly, Fantasy, Turn-Based Strategy, Casual, Turn-Based Combat, Tactical RPG, Puzzle, PvP, Competitive, Difficult, Turn-Based, Strategy RPG, Action-Adventure, Female Protagonist, Strategy, Cute, Cartoony, Tactical, Medieval",60
99900,Spiral Knights,"Jun 14, 2011",0.0,"['English', 'French', 'German', 'Spanish - Spain']",Grey Havens,Grey Havens,"Single-player, Multi-player, MMO, Co-op, Steam Achievements, Steam Trading Cards, In-App Purchases, Partial Controller Support, Includes level editor","Action, Adventure, Casual, Indie, Massively Multiplayer, RPG, Free To Play","Free to Play, Massively Multiplayer, RPG, Adventure, Action, Multiplayer, Online Co-Op, Dungeon Crawler, Hack and Slash, Co-op, MMORPG, Cute, Great Soundtrack, Action RPG, Sci-fi, Open World, Casual, Singleplayer, Indie, Anime",64
544610,Battlestar Galactica Deadlock,"Aug 31, 2017",0.0,"['English', 'French', 'German', 'Spanish - Spain', 'Russian']",Black Lab Games,Slitherine Ltd.,"Single-player, Multi-player, PvP, Online PvP, Co-op, Online Co-op, Steam Achievements, Steam Trading Cards, Partial Controller Support, Steam Cloud, Family Sharing",Strategy,"Strategy, Space, Sci-fi, Turn-Based, Turn-Based Strategy, Turn-Based Tactics, Singleplayer, War, Simulation, Turn-Based Combat, Multiplayer, Tactical, Replay Value, Atmospheric, 4X, Great Soundtrack, Co-op, Controller, Action, Adventure",77
45720,Lost Planet: Extreme Condition Colonies Edition,"Feb 11, 2010",0.0,"['English', 'French', 'German', 'Italian', 'Spanish - Spain']","CAPCOM CO., LTD.",Capcom,"Single-player, Multi-player, Cross-Platform Multiplayer, Partial Controller Support","Action, Adventure","Action, Adventure, Third-Person Shooter, Mechs, Singleplayer",70
517630,Just Cause 4 Reloaded,"Dec 4, 2018",0.0,"['English', 'French', 'Italian', 'German', 'Spanish - Spain', 'Arabic', 'Portuguese - Brazil', 'Russian', 'Korean', 'Simplified Chinese', 'Traditional Chinese', 'Polish', 'Japanese']",Avalanche Studios,Square Enix,"Single-player, Steam Achievements, Full controller support, Steam Trading Cards, Steam Cloud, Remote Play on TV, Family Sharing","Action, Adventure","Open World, Action, Destruction, Singleplayer, Adventure, Sandbox, Third-Person Shooter, Shooter, Physics, Violent, Funny, Story Rich, Gore, Atmospheric, Co-op, Driving, Third Person, FPS, Heist, Comedy",68
21660,Street Fighter® IV,"Jul 7, 2009",0.0,['English'],Capcom,Capcom,"Single-player, Multi-player, PvP, Shared/Split Screen PvP, Partial Controller Support, Remote Play Together",Action,"Fighting, Action, Arcade, Local Multiplayer, Multiplayer, 2D Fighter, 2.5D, Beat 'em up, Competitive, 2D, Anime",91
536990,Redie,"Dec 1, 2016",0.0,"['English', 'German', 'Russian']",Rückert Broductions,Rückert Broductions,"Single-player, Steam Achievements, Steam Trading Cards, Partial Controller Support, Steam Cloud, Stats, Steam Leaderboards","Action, Indie","Action, Gore, Indie, Top-Down Shooter, Free to Play, Top-Down, Violent",79
429680,Spellweaver,"Feb 1, 2016",0.0,"['English', 'French', 'German', 'Spanish - Spain', 'Czech', 'Dutch', 'Polish', 'Portuguese - Brazil', 'Russian', 'Simplified Chinese']",Dream Reactor,Dream Reactor,"Single-player, Multi-player, MMO, Steam Achievements, Steam Trading Cards","Free To Play, Indie, Massively Multiplayer, Strategy","Card Game, Free to Play, Strategy, Indie, Massively Multiplayer, Trading Card Game, Multiplayer",63
381990,Dragon Saga,"Dec 22, 2015",0.0,"['English', 'French', 'German', 'Spanish - Spain', 'Portuguese - Portugal']",Gravity Interactive,Gravity Interactive,"Single-player, Multi-player, MMO, PvP, Online PvP, Co-op, Online Co-op, Steam Achievements, Steam Trading Cards, In-App Purchases, Partial Controller Support","Action, Adventure, Casual, Massively Multiplayer, Racing, RPG, Free To Play","Free to Play, Massively Multiplayer, MMORPG, RPG, Anime, Action, Multiplayer, Dragons, Adventure, Cute, Casual, PvP, Side Scroller, Racing, Hack and Slash",65
368230,Kingdom: Classic,"Oct 21, 2015",0.0,"['English', 'French', 'Italian', 'German', 'Spanish - Spain', 'Danish', 'Finnish', 'Norwegian', 'Portuguese - Brazil', 'Swedish']","Noio, Licorice",Raw Fury,"Single-player, Steam Achievements, Full controller support, Steam Trading Cards, Steam Cloud, Remote Play on Phone, Remote Play on Tablet, Remote Play on TV","Indie, Simulation, Strategy","Free to Play, Strategy, Singleplayer, Simulation, Base-Building, Building, 2D, Management, Resource Management, RPG, Pixel Graphics, Fantasy, Survival, Casual, Adventure, City Builder, Indie, Colony Sim, Tower Defense, Atmospheric",74
24810,Command & Conquer™ 3: Kane’s Wrath,"Nov 13, 2009",0.0,"['Dutch', 'English', 'French', 'German', 'Italian', 'Polish', 'Russian', 'Spanish - Spain', 'Swedish', 'Hungarian', 'Czech', 'Korean', 'Simplified Chinese', 'Thai', 'Traditional Chinese']",EA Los Angeles,Electronic Arts,"Single-player, Multi-player, Steam Workshop, Steam Cloud, Includes level editor, Family Sharing","Action, Strategy","Family Friendly, Level Editor, Strategy, Action, Multiplayer, Singleplayer, Co-op, Grand Strategy, 3D, RTS, Base-Building, Sci-fi, FMV, Story Rich, Atmospheric, Post-apocalyptic, War, Aliens, Building, Difficult",77
431650,Phoning Home,"Feb 7, 2017",0.0,"['English', 'German', 'French', 'Spanish - Spain', 'Russian', 'Hungarian', 'Simplified Chinese', 'Polish']",ION LANDS,ION LANDS,"Single-player, Steam Achievements, Full controller support, Steam Trading Cards, Steam Cloud","Action, Adventure, Indie","Adventure, Action, Indie, Survival, Open World Survival Craft, Open World, Exploration, Crafting, Robots, Singleplayer, Sci-fi, Atmospheric, Nature, Third Person, Story Rich, Mystery, Puzzle, Great Soundtrack, Futuristic, Silent Protagonist",61
45750,Lost Planet® 2,"Oct 15, 2010",0.0,"['English', 'French', 'German', 'Italian', 'Spanish - Spain', 'Japanese', 'Korean', 'Polish', 'Russian']","CAPCOM CO., LTD.",Capcom,"Single-player, Multi-player, Co-op, Partial Controller Support","Action, Adventure","Action, Co-op, Adventure, Mechs, Third-Person Shooter, Sci-fi, Multiplayer, Third Person, Online Co-Op, Cult Classic, Shooter, Character Customization, Singleplayer, Aliens, Co-op Campaign, Atmospheric",63
230230,Divinity: Original Sin (Classic),"Jun 30, 2014",0.0,"['English', 'French', 'German', 'Russian', 'Polish', 'Italian', 'Czech']",Larian Studios,Larian Studios,"Single-player, Multi-player, Co-op, Cross-Platform Multiplayer, Steam Achievements, Steam Trading Cards, Captions available, Steam Workshop, Steam Cloud, Includes level editor, Remote Play Together, Family Sharing","Adventure, Indie, RPG, Strategy","RPG, Turn-Based, Co-op, Fantasy, Adventure, Strategy, Open World, Isometric, CRPG, Story Rich, Kickstarter, Singleplayer, Indie, Multiplayer, Turn-Based Strategy, Magic, Online Co-Op, Crowdfunded, Atmospheric, Female Protagonist",87
244050,Rise of Flight United,"Sep 5, 2013",0.0,"['English', 'Russian']","1C Game Studios, 777 Studios",FOR-GAMES CR LTD,"Single-player, Multi-player, Co-op, Steam Achievements, Partial Controller Support, Stats","Simulation, Free To Play","Simulation, Flight, Free to Play, World War I, Multiplayer, Historical, Singleplayer, Action, Realistic, World War II, War, Military, Shooter, Co-op, Massively Multiplayer, Open World, VR, Jet, TrackIR",77
236390,War Thunder,"Aug 15, 2013",0.0,"['English', 'German', 'French', 'Italian', 'Spanish - Spain', 'Simplified Chinese', 'Russian', 'Japanese', 'Polish', 'Czech', 'Turkish', 'Portuguese - Portugal', 'Korean', 'Portuguese - Brazil', 'Hungarian', 'Ukrainian', 'Traditional Chinese', 'Romanian']",Gaijin Entertainment,Gaijin Network Ltd,"Single-player, Multi-player, MMO, PvP, Online PvP, Co-op, Online Co-op, Cross-Platform Multiplayer, Steam Achievements, Full controller support, VR Supported, Steam Trading Cards, In-App Purchases, Adjustable Text Size, Camera Comfort, Color Alternatives, Custom Volume Controls, Playable without Timed Input, Stereo Sound, Surround Sound, Remote Play on Phone, Remote Play on Tablet","Action, Massively Multiplayer, Simulation, Free To Play","Free to Play, Simulation, Vehicular Combat, Combat, World War II, Flight, VR, War, Military, Tanks, Multiplayer, Naval Combat, Modern, Massively Multiplayer, Cold War, Realistic, Shooter, Action, Third Person, Third-Person Shooter",81
57400,Batman: Arkham City,"Nov 15, 2011",0.0,"['English', 'French', 'German', 'Italian', 'Polish', 'Portuguese - Brazil', 'Russian', 'Spanish - Spain']",Rocksteady Studios,Warner Bros. Interactive Entertainment,"Single-player, Steam Achievements, Partial Controller Support, Steam Cloud","Action, Adventure","Action, Adventure, Open World, Third Person, Superhero, Singleplayer, Stealth",91
2172860,The Elder Scrolls Online: Necrom,"Jun 5, 2023",0.0,"['English', 'French', 'German', 'Russian', 'Spanish - Spain', 'Simplified Chinese']",ZeniMax Online Studios,Bethesda Softworks,"Multi-player, MMO, PvP, Online PvP, Co-op, Online Co-op, Steam Trading Cards, Captions available, In-App Purchases, Partial Controller Support","Action, Adventure, Massively Multiplayer, RPG","RPG, Action, Adventure, Massively Multiplayer, Open World, Fantasy, MMORPG, Exploration, Supernatural, Multiplayer, Singleplayer, Character Customization, Story Rich, PvP, PvE, Choose Your Own Adventure, Lore-Rich, Action RPG, Class-Based, Dark Fantasy",82
588430,Fallout Shelter,"Mar 29, 2017",0.0,"['English', 'French', 'Italian', 'German', 'Spanish - Spain', 'Russian']",Bethesda Game Studios,Bethesda Softworks,"Single-player, Steam Achievements, Full controller support, In-App Purchases, Playable without Timed Input, Stereo Sound, Steam Cloud, Stats","RPG, Simulation, Free To Play","Free to Play, Base-Building, Survival, Post-apocalyptic, Singleplayer, Management, Simulation, Strategy, 2D, Building, Casual, Crafting, Adventure, Multiplayer, Sandbox, RPG, Funny, Atmospheric, Action, Great Soundtrack",63
8320,Bone: The Great Cow Race,"Jun 17, 2008",0.0,['English'],Telltale Games,,"Single-player, Family Sharing",Adventure,"Adventure, Point & Click",76
261570,Ori and the Blind Forest,"Mar 10, 2015",0.0,"['English', 'French', 'Italian', 'German', 'Spanish - Spain', 'Japanese', 'Russian', 'Simplified Chinese', 'Portuguese - Brazil']",Moon Studios GmbH,Xbox Game Studios,"Single-player, Steam Achievements, Full controller support, Steam Trading Cards, Steam Cloud, Stats, Remote Play on TV, Family Sharing",Action,"Great Soundtrack, Atmospheric, Platformer, Adventure, Metroidvania, Story Rich, Fantasy, 2D, Cute, Singleplayer, Difficult, Action, Indie, Puzzle-Platformer, Exploration, Puzzle, Side Scroller, Open World, Family Friendly, RPG",88
201230,EverQuest II,"Dec 7, 2011",0.0,['English'],Darkpaw Games,Daybreak Game Company,"Multi-player, MMO","Massively Multiplayer, RPG, Free To Play","Free to Play, RPG, Massively Multiplayer, MMORPG, Fantasy, Crafting, Open World, Adventure, Multiplayer, Exploration, Action, Character Customization, Dwarf, Singleplayer, Classic, Sandbox, Third Person, First-Person, Dragons",83
385730,WWE 2K16,"Mar 10, 2016",0.0,"['English', 'French', 'Italian', 'German', 'Spanish - Spain', 'Arabic']","Visual Concepts, Yuke's Co., LTD",2K,"Single-player, Multi-player, Co-op, Shared/Split Screen, Full controller support, Remote Play on TV, Remote Play Together, Family Sharing","Simulation, Sports","Sports, Fighting, Wrestling, Simulation, Multiplayer, Action, Singleplayer, Character Customization, Memes, Co-op, Funny, Local Co-Op, Nudity, Great Soundtrack",74
493180,Dynasty Feud,"May 23, 2017",0.0,"['English', 'French', 'German', 'Spanish - Spain', 'Portuguese - Brazil', 'Russian', 'Simplified Chinese']",Kaia Studios,Kaia Studios,"Multi-player, PvP, Online PvP, Shared/Split Screen PvP, Shared/Split Screen, Steam Achievements, Full controller support, Steam Trading Cards, Steam Cloud, Stats, Steam Leaderboards, Remote Play Together","Action, Indie","Action, Indie, Multiplayer, 4 Player Local, Fighting, Local Multiplayer, 2D Fighter, 2D",68
370440,No70: Eye of Basir,"Jun 28, 2017",0.0,"['English', 'French', 'German', 'Simplified Chinese', 'Portuguese - Brazil', 'Japanese', 'Korean', 'Polish', 'Russian', 'Turkish', 'Italian', 'Spanish - Spain']",Oldmoustache Gameworks,Clock Wizard Games,"Single-player, Steam Achievements, Steam Trading Cards, Captions available, Partial Controller Support","Adventure, Indie","Indie, Adventure, Horror, Puzzle, Walking Simulator, Psychological Horror, Multiplayer, Thriller, Atmospheric, First-Person",52
1157090,Eidolon,"Nov 18, 2019",0.0,['English'],Julia Nolan,Integral Games,"Single-player, Steam Achievements",Indie,"Indie, Visual Novel, Free to Play, Anime, Philosophical",64
47410,Stronghold Kingdoms,"Feb 27, 2012",0.0,"['English', 'French', 'German', 'Italian', 'Polish', 'Portuguese - Brazil', 'Russian', 'Spanish - Spain', 'Turkish', 'Simplified Chinese', 'Traditional Chinese', 'Japanese', 'Korean']",Firefly Studios,Firefly Studios,"Multi-player, MMO, PvP, Online PvP, Co-op, Online Co-op, Cross-Platform Multiplayer, Steam Trading Cards","Massively Multiplayer, Strategy, Free To Play","Strategy, Free to Play, Massively Multiplayer, Medieval, City Builder, Multiplayer, Building, Base-Building, War, RTS, Real-Time, PvP, Simulation, Sandbox, Colony Sim, Grand Strategy, Real Time Tactics, Wargame, Idler, Isometric",75
25600,Eschalon: Book I,"Feb 10, 2009",0.0,['English'],Basilisk Games,Basilisk Games,Single-player,"Indie, RPG","RPG, Indie, Isometric, Turn-Based, Fantasy, 2D, Singleplayer, Old School, CRPG, Free to Play, Exploration, Turn-Based Combat, Open World",75
2995920,It Takes Two Friend's Pass,"May 25, 2021",0.0,"['English', 'French', 'Italian', 'German', 'Spanish - Spain', 'Japanese', 'Korean', 'Polish', 'Portuguese - Brazil', 'Russian', 'Simplified Chinese', 'Traditional Chinese']",Hazelight Studio,Electronic Arts,"Multi-player, Co-op, Online Co-op, Shared/Split Screen Co-op, Shared/Split Screen, Full controller support","Action, Adventure, Indie",,89
1538680,Blake: The Visual Novel,"Aug 31, 2021",0.0,['English'],Ori Mees,LegendOri Productions,"Single-player, Steam Achievements","Casual, Indie","Choose Your Own Adventure, Interactive Fiction, Visual Novel, Comic Book, Noir, Detective, Choices Matter, Conversation, Story Rich, Indie, Casual, Thriller, Comedy, Crime, Emotional, Mystery, Psychological, Dark, Futuristic, Cyberpunk",82
2183600,Kingdom Under Fire: A War of Heroes (GOLD Edition),"Dec 6, 2022",0.0,['English'],"Bloom Technology, Blueside","IncrediSoft, Bloom Technology","Single-player, Multi-player, PvP, Online PvP","Action, RPG, Strategy, Free To Play, Early Access",,59
700480,Microsoft Allegiance,"Sep 29, 2017",0.0,['English'],Microsoft Game Studios,ZapHop Games,"Multi-player, PvP, Online PvP, Steam Achievements, Partial Controller Support, Stats, Steam Leaderboards","Action, Simulation, Strategy, Free To Play","Team-Based, Free to Play, Space Sim, FPS, RTS, Competitive, Multiplayer, Action, Real Time Tactics, Wargame, PvP, 3D Fighter, Strategy, Space, Economy, War, Physics, Combat, Old School, Online Co-Op",86
47920,Shift 2 Unleashed,"Mar 29, 2011",0.0,"['English', 'French', 'German', 'Italian', 'Polish', 'Russian', 'Spanish - Spain']",Slightly Mad Studios,Electronic Arts,"Single-player, Multi-player, Partial Controller Support, Family Sharing",Racing,"Racing, Automobile Sim, Simulation, Driving, Multiplayer, Realistic, Singleplayer, First-Person",84
317620,Space Hulk: Ascension,"Nov 12, 2014",0.0,['English'],Full Control Studios,Full Control,"Single-player, Steam Achievements, Steam Trading Cards, Steam Leaderboards, Family Sharing","RPG, Strategy","Warhammer 40K, Strategy, Turn-Based Tactics, RPG, Games Workshop, Turn-Based, Tactical, Board Game, Sci-fi, Turn-Based Strategy, Singleplayer, Action",72
228400,Ace Combat Assault Horizon - Enhanced Edition,"Jan 25, 2013",0.0,"['English', 'German', 'French', 'Italian', 'Spanish - Spain', 'Simplified Chinese', 'Russian', 'Polish']",NAMCO,BANDAI NAMCO Entertainment,"Single-player, Multi-player, Co-op, Steam Achievements, Partial Controller Support, Steam Cloud, Steam Leaderboards","Action, Simulation","Action, Flight, Simulation, Military, Arcade, Quick-Time Events, Cinematic, Multiplayer, Controller, Shooter, Great Soundtrack, Co-op, War, On-Rails Shooter, Singleplayer, Casual, Jet",77
2915930,Knockout City - Private Server Edition,"May 24, 2024",0.0,['English'],Velan Studios,Velan Studios,"Single-player, Multi-player, PvP, Online PvP, LAN PvP, Full controller support","Action, Adventure, Sports, Free To Play",,80
225600,Blade Symphony,"May 7, 2014",0.0,"['English', 'Japanese', 'Russian', 'German', 'Spanish - Spain', 'Dutch', 'Hungarian', 'Portuguese - Portugal', 'French', 'Korean', 'Portuguese - Brazil', 'Italian', 'Czech', 'Danish', 'Norwegian', 'Polish', 'Romanian', 'Simplified Chinese', 'Traditional Chinese', 'Turkish']",Puny Human,Puny Human,"Multi-player, PvP, Online PvP, Shared/Split Screen PvP, Cross-Platform Multiplayer, Steam Achievements, Steam Trading Cards, Steam Workshop, In-App Purchases, Partial Controller Support, Steam Cloud, Stats, Includes level editor, Includes Source SDK, Remote Play Together","Action, Indie","Action, Fighting, Indie, Multiplayer, Swordplay, Competitive, Third Person, Hack and Slash, Ninja, Parkour, Sci-fi, PvP, Strategy, Kickstarter, Tactical, Early Access, Fantasy, Great Soundtrack, Adventure, Free to Play",72
31280,Poker Night at the Inventory,"Nov 22, 2010",0.0,['English'],Telltale Games,,"Single-player, Steam Achievements, Family Sharing","Casual, Sports","Card Game, Casual, Comedy, Singleplayer, Funny, Gambling, Strategy, Sports, Conversation, Simulation, Memes, Indie, First-Person, Touch-Friendly, Point & Click, Board Game, Multiplayer, Action, Relaxing, Great Soundtrack",71
872790,Football Manager 2019,"Nov 2, 2018",0.0,"['English', 'French', 'Italian', 'German', 'Spanish - Spain', 'Czech', 'Danish', 'Dutch', 'Greek', 'Korean', 'Norwegian', 'Polish', 'Portuguese - Portugal', 'Russian', 'Simplified Chinese', 'Swedish', 'Traditional Chinese', 'Turkish']",Sports Interactive,SEGA,"Single-player, Multi-player, Steam Achievements, Steam Trading Cards, Steam Workshop, Steam Cloud, Steam Leaderboards, Remote Play on Tablet, Family Sharing","Simulation, Sports","Simulation, Sports, Football (Soccer), Management, Football (American), Strategy, Multiplayer, Singleplayer, Addictive, Tactical, Economy, Casual, Real Time Tactics, Free to Play",86
265690,NaissanceE,"Feb 13, 2014",0.0,['English'],Limasse Five,Limasse Five,Single-player,"Adventure, Indie","Exploration, Indie, Atmospheric, Abstract, Walking Simulator, First-Person, Adventure, Surreal, Puzzle, Platformer, Puzzle-Platformer, Horror, Female Protagonist, Singleplayer, Psychedelic, Beautiful, Free to Play, Minimalist, Great Soundtrack, Parkour",66
259020,Dragon's Prophet,"Sep 18, 2013",0.0,"['English', 'French', 'German']",Runewaker,Infernum Productions AG,MMO,"Action, Free To Play, Massively Multiplayer, RPG","Free to Play, Dragons, Massively Multiplayer, RPG, Action, MMORPG, Open World, Adventure, Fantasy",63
386360,SMITE®,"Sep 8, 2015",0.0,"['English', 'French', 'German', 'Spanish - Spain', 'Polish', 'Russian', 'Portuguese - Brazil', 'Turkish', 'Simplified Chinese', 'Japanese']",Titan Forge Games,Hi-Rez Studios,"Multi-player, PvP, Steam Achievements, Full controller support, Steam Trading Cards, In-App Purchases","Action, Adventure, Casual, Indie, Massively Multiplayer, RPG, Simulation, Strategy, Free To Play","Free to Play, MOBA, Multiplayer, Action, Third Person, Mythology, Strategy, MMORPG, Team-Based, Nostalgia, Competitive, Anime, PvP, Co-op, e-sports, Massively Multiplayer, RPG, Adventure, Casual, Strategy RPG",83
377300,Thunder Tier One,"Dec 7, 2021",0.0,"['English', 'Russian', 'German', 'Simplified Chinese', 'Korean', 'Traditional Chinese']","KRAFTON, Inc.","KRAFTON, Inc.","Single-player, Multi-player, PvP, Online PvP, Co-op, Online Co-op, Steam Achievements, Steam Workshop, Steam Cloud, Stats, Steam Leaderboards","Action, Simulation, Free To Play","Free to Play, Online Co-Op, Top-Down Shooter, Tactical, Shooter, Realistic, Top-Down, Military, Multiplayer, Co-op, Singleplayer, Combat, PvE, PvP, Moddable, Action, Character Customization, Difficult, Team-Based, Real Time Tactics",65
254980,Silent Storm Sentinels,"Oct 2, 2013",0.0,"['English', 'French', 'German', 'Russian']",,,"Single-player, Family Sharing","Action, RPG, Strategy",,83
312450,Order of Battle: World War II,"Apr 30, 2015",0.0,"['English', 'French', 'German', 'Spanish - Spain', 'Russian']",The Artistocrats,Slitherine Ltd.,"Single-player, Multi-player, Steam Achievements, Steam Trading Cards, Steam Cloud, Includes level editor","Simulation, Strategy, Free To Play","Strategy, Free to Play, World War II, Simulation, Turn-Based, Wargame, Turn-Based Strategy, Multiplayer, Hex Grid, Singleplayer, War, Turn-Based Tactics, Historical, Tactical, Replay Value, Turn-Based Combat, Moddable, Asynchronous Multiplayer, Level Editor, Co-op",81
18110,Shattered Horizon,"Nov 4, 2009",0.0,['English'],Futuremark,Futuremark,"Single-player, Multi-player, Valve Anti-Cheat enabled, Family Sharing","Action, Indie","Action, Indie, FPS, Space, Multiplayer, Sci-fi, 6DOF, Shooter, First-Person",72
793170,Seeking Dawn: Free to Play Edition,"Nov 1, 2018",0.0,"['English', 'Simplified Chinese', 'Traditional Chinese']",Multiverse,Multiverse,"Single-player, Multi-player, Online PvP, Co-op, Online Co-op, VR Only, Family Sharing","Adventure, Free To Play, Indie","Adventure, Free to Play, Indie, VR",68
23310,The Last Remnant™,"Apr 9, 2009",0.0,"['English', 'French', 'Italian', 'German', 'Spanish - Spain', 'Japanese']",Square Enix,Square Enix,"Single-player, Partial Controller Support, Family Sharing",RPG,"JRPG, RPG, Singleplayer, Fantasy, Turn-Based, Great Soundtrack, Turn-Based Strategy, Story Rich, Strategy, Turn-Based Tactics, Adventure, Difficult, Tactical, Controller, Open World, Action, Turn-Based Combat",66
4580,"Warhammer® 40,000: Dawn of War® - Dark Crusade","Aug 7, 2007",0.0,"['English', 'French', 'German', 'Italian', 'Spanish - Spain']",Relic Entertainment,SEGA,"Single-player, Multi-player, Steam Cloud, Family Sharing",Strategy,"Strategy, Warhammer 40K, RTS, Base-Building, Sci-fi, Multiplayer, Singleplayer, Games Workshop, Real-Time, Classic, War, Gore, Action, Tactical, Atmospheric, Co-op, Fantasy, Space, Violent, Adventure",87
352240,The Westport Independent,"Jan 21, 2016",0.0,['English'],Double Zero One Zero,Double Zero One Zero,"Single-player, Steam Achievements, Steam Cloud","Indie, Simulation","Indie, Simulation, Dystopian , Political, Choices Matter, Free to Play, Singleplayer",63
