appID,name,release_date,price,supported_languages,developers,publishers,categories,genres,tags,metacriticScore
1692250,F1® 22,"Jul 1, 2022",0.0,"['English', 'French', 'Italian', 'German', 'Spanish - Spain', 'Dutch', 'Japanese', 'Portuguese - Brazil', 'Simplified Chinese', 'Polish', 'Russian']",Codemasters,Electronic Arts,"Single-player, Multi-player, PvP, Online PvP, LAN PvP, Shared/Split Screen PvP, Co-op, Online Co-op, LAN Co-op, Shared/Split Screen, Steam Achievements, Full controller support, VR Supported, Steam Workshop, In-App Purchases, Steam Cloud, Remote Play Together, HDR available, Family Sharing","Racing, Sports","Racing, Immersive Sim, VR, Sports, Driving, Automobile Sim, Controller, PvP, Multiplayer, Simulation, Realistic, Co-op, Online Co-Op, Singleplayer, Memes, Split Screen, Local Multiplayer, Action, Open World, Arcade",81
250640,[Old Edition] Croixleur Sigma,"Apr 30, 2014",0.0,"['English', 'Japanese', 'Simplified Chinese']",souvenir circ.,PLAYISM,"Single-player, Multi-player, PvP, Shared/Split Screen PvP, Shared/Split Screen, Steam Achievements, Steam Trading Cards, Partial Controller Support, Steam Cloud, Steam Leaderboards, Remote Play Together, Family Sharing","Action, Casual, Indie","Anime, Action, Hack and Slash, Indie, Female Protagonist, Casual, Great Soundtrack, Fighting, Beat 'em up, Cute",56
297660,Super Rad Raygun,"Nov 8, 2016",0.0,['English'],TRU FUN Entertainment,,"Single-player, Steam Achievements, Full controller support, Steam Trading Cards, Steam Leaderboards, Family Sharing","Action, Adventure, Indie","Action, Indie, Adventure, Platformer, Retro, Pixel Graphics, 2D",64
271590,Grand Theft Auto V Legacy,"Apr 13, 2015",0.0,"['English', 'French', 'Italian', 'German', 'Spanish - Spain', 'Korean', 'Polish', 'Portuguese - Brazil', 'Russian', 'Traditional Chinese', 'Japanese', 'Simplified Chinese', 'Spanish - Latin America']",Rockstar North,Rockstar Games,"Single-player, Multi-player, PvP, Online PvP, Co-op, Online Co-op, Steam Achievements, Full controller support, Remote Play on Phone, Remote Play on Tablet, Remote Play on TV","Action, Adventure","Open World, Action, Multiplayer, Crime, Automobile Sim, Third Person, First-Person, Mature, Shooter, Adventure, Singleplayer, Third-Person Shooter, Racing, Co-op, Sandbox, Atmospheric, Funny, Great Soundtrack, Comedy, Moddable",96
238430,Contagion,"Apr 14, 2014",0.0,"['English', 'Simplified Chinese', 'Traditional Chinese', 'Portuguese - Brazil', 'Korean', 'Turkish', 'Italian', 'Russian', 'Japanese', 'Ukrainian', 'Spanish - Spain']","Monochrome, Inc","Monochrome, Inc","Single-player, Multi-player, PvP, Online PvP, Co-op, Online Co-op, Steam Achievements, Steam Trading Cards, Captions available, Steam Workshop, Camera Comfort, Custom Volume Controls, Adjustable Difficulty, Playable without Timed Input, Stereo Sound, Subtitle Options, Partial Controller Support, Steam Cloud, Stats, Steam Leaderboards, Includes level editor, Family Sharing","Action, Adventure, Indie","Zombies, Post-apocalyptic, Co-op, Horror, Level Editor, FPS, Moddable, PvE, First-Person, PvP, Survival Horror, Shooter, Competitive, Survival, 3D, Action, Local Multiplayer, Local Co-Op, Atmospheric, Adventure",62
1286830,STAR WARS™: The Old Republic™,"Jul 21, 2020",0.0,"['English', 'French', 'German']",Broadsword,Electronic Arts,"Multi-player, MMO, PvP, Co-op, Steam Achievements, Steam Trading Cards, In-App Purchases","Massively Multiplayer, RPG, Free To Play","Free to Play, Multiplayer, MMORPG, Character Customization, Open World, RPG, Story Rich, Choices Matter, Massively Multiplayer, Sci-fi, Adventure, Space, Action, Third Person, PvP, Atmospheric, Action RPG, Party-Based RPG, Great Soundtrack, Controller",85
427270,Orcs Must Die! Unchained,"Apr 19, 2017",0.0,"['English', 'French', 'German', 'Spanish - Spain', 'Russian']",Robot Entertainment,Robot Entertainment,"Single-player, Multi-player, Co-op, Steam Achievements, In-App Purchases, Partial Controller Support, Family Sharing","Action, Free To Play, Strategy","Free to Play, Tower Defense, Multiplayer, Co-op, Action, Strategy, MOBA, PvE, Survival, Fantasy, Singleplayer, Third Person, PvP, RPG, Adventure, Funny, Massively Multiplayer, Online Co-Op, FPS, Open World",87
203770,Crusader Kings II,"Feb 14, 2012",0.0,"['English', 'French', 'German', 'Spanish - Spain']",Paradox Development Studio,Paradox Interactive,"Single-player, Multi-player, Steam Trading Cards","RPG, Simulation, Strategy, Free To Play","Grand Strategy, Strategy, Medieval, Historical, Political Sim, Simulation, RPG, Sandbox, Multiplayer, Politics, Diplomacy, Singleplayer, Replay Value, Real-Time with Pause, Moddable, Political, Free to Play, Character Customization, RTS, Great Soundtrack",82
227220,Sang-Froid - Tales of Werewolves,"Apr 5, 2013",0.0,"['English', 'French']",Artifice Studio,Artifice Studio,"Single-player, Steam Achievements, Steam Trading Cards","Action, Adventure, Indie, RPG, Strategy","Strategy, Werewolves, Tower Defense, Action, Indie, RPG, Adventure, Great Soundtrack, Singleplayer, Atmospheric, Third Person, Free to Play",79
202070,Choplifter HD,"Jan 11, 2012",0.0,"['English', 'French', 'German', 'Italian', 'Spanish - Spain']",inXile Entertainment,inXile Entertainment,"Single-player, Steam Achievements, Partial Controller Support, Steam Leaderboards, Family Sharing",Action,"Action, Arcade, Zombies, Classic, Shoot 'Em Up",65
212070,Star Conflict,"Feb 27, 2013",0.0,"['English', 'Russian', 'French', 'German', 'Spanish - Spain', 'Portuguese - Portugal', 'Polish', 'Hungarian', 'Czech', 'Ukrainian', 'Simplified Chinese']",Star Gem Inc.,Gaijin Network Ltd,"Multi-player, MMO, Co-op, Steam Achievements, Steam Trading Cards, VR Support, Custom Volume Controls, Playable without Timed Input, Partial Controller Support","Action, Adventure, Massively Multiplayer, RPG, Simulation, Free To Play","Online Co-Op, Free to Play, Space Sim, Open World, Massively Multiplayer, Action, PvE, Trading, Sandbox, Shooter, Flight, Crafting, 3D, Choose Your Own Adventure, RPG, Third Person, Sci-fi, Atmospheric, Science, Aliens",75
15270,Cold Fear™,"May 13, 2008",0.0,"['English', 'French', 'Italian', 'German', 'Spanish - Spain']",Darkworks,Ubisoft,"Single-player, Family Sharing",Action,"Horror, Action, Survival Horror, Third-Person Shooter, Classic, Zombies, Third Person, Gore, Atmospheric, Singleplayer, Adventure, Shooter",66
215280,Secret World Legends,"Jul 31, 2017",0.0,"['English', 'French', 'German']",Funcom,Funcom,"Multi-player, MMO, PvP, Online PvP, Co-op, Online Co-op, Steam Trading Cards","Action, Adventure, Massively Multiplayer, RPG, Free To Play","MMORPG, Massively Multiplayer, Lovecraftian, RPG, Horror, Story Rich, Illuminati, Conspiracy, Open World, Action, Free to Play, Supernatural, Mythology, Adventure, Exploration, Puzzle, Multiplayer, Character Customization, Zombies, Third Person",76
15130,Beyond Good and Evil™,"May 13, 2008",0.0,"['English', 'French', 'German', 'Italian', 'Spanish - Spain']",Ubisoft Montpellier,Ubisoft,"Single-player, Family Sharing","Action, Adventure","Adventure, Female Protagonist, Action, Third Person, Cult Classic, Stealth, Classic, Singleplayer, Sci-fi, Action-Adventure, Great Soundtrack, Story Rich, Open World, Emotional, Dystopian , Platformer, Atmospheric, Exploration, Conspiracy, Aliens",83
41300,Altitude,"Dec 4, 2009",0.0,['English'],Nimbly Games,Nimbly Games,"Single-player, Multi-player, PvP, Online PvP, LAN PvP, Co-op, Online Co-op, LAN Co-op, Cross-Platform Multiplayer, Steam Achievements, Partial Controller Support, Stats, Includes level editor","Action, Casual, Free To Play, Indie, Simulation, Strategy","Multiplayer, Flight, Side Scroller, Shoot 'Em Up, Strategy, PvP, Competitive, Football (Soccer), Shooter, Arcade, 2D Fighter, 2D, Funny, Controller, Casual, Team-Based, Vehicular Combat, Simulation, Action, Cartoony",79
3399980,Down the Rabbit Hole Flattened,"Jun 18, 2025",0.0,"['English', 'French', 'Italian', 'German', 'Spanish - Spain', 'Japanese', 'Korean', 'Portuguese - Brazil', 'Simplified Chinese', 'Spanish - Latin America']",Cortopia Studios,Beyond Frames,Single-player,"Adventure, Indie, Free To Play",,68
376570,WildStar,"Jun 9, 2016",0.0,"['English', 'French', 'German']",Carbine Studios,NCSOFT,"MMO, Online PvP, Steam Achievements, Steam Trading Cards, In-App Purchases, Family Sharing","Free To Play, Massively Multiplayer, RPG","Free to Play, Massively Multiplayer, MMORPG, Open World, RPG, Sci-fi, PvP, PvE, Multiplayer, Character Customization, Action, Funny, Adventure, Action-Adventure, Fantasy, Building, Co-op, Cartoony, Survival, FPS",82
29700,Guild Wars: Eye of the North®,"Oct 8, 2010",0.0,"['English', 'French', 'German', 'Italian', 'Japanese', 'Korean', 'Polish', 'Russian', 'Spanish - Spain']",ArenaNet®,"NCSOFT, ArenaNet®","Single-player, Multi-player, MMO, Co-op, Family Sharing","Action, Massively Multiplayer, RPG","RPG, Massively Multiplayer, Action, MMORPG, Fantasy, Co-op, Multiplayer",79
382120,Journey To The Center Of The Earth,"Sep 25, 2015",0.0,['English'],InSayn,InSayn,"Single-player, Full controller support, Steam Trading Cards, Family Sharing","Adventure, Casual, Free To Play, Indie","Indie, Adventure, Casual, Platformer, Free to Play",65
402630,The Coma: Cutting Class,"Oct 19, 2015",0.0,"['English', 'Korean', 'Russian', 'French', 'Thai', 'Japanese', 'Simplified Chinese', 'Spanish - Spain', 'Turkish']",Devespresso Games,Devespresso Games,"Single-player, Steam Trading Cards, Family Sharing","Adventure, Indie","Adventure, Indie, Horror, Survival Horror, Anime",69
209870,Blacklight: Retribution,"Jul 2, 2012",0.0,"['English', 'German', 'French', 'Italian', 'Spanish - Spain', 'Japanese', 'Russian']","Hardsuit Labs, Inc.","Hardsuit Labs, Inc.","Multi-player, Steam Achievements, Steam Trading Cards, Includes level editor, Family Sharing","Action, Free To Play","Free to Play, FPS, Multiplayer, Action, Shooter, Gun Customization, First-Person, Futuristic, Mechs, Co-op, Sci-fi, Military, Cyberpunk, Zombies, Singleplayer, Massively Multiplayer, Tactical, Fast-Paced, Competitive, RPG",75
214250,I Am Alive,"Sep 6, 2012",0.0,"['English', 'French', 'German', 'Italian', 'Spanish - Spain']",Ubisoft  Shanghaï,Ubisoft,"Single-player, Partial Controller Support, Family Sharing","Action, Adventure","Survival, Post-apocalyptic, Action, Adventure, Third Person, Singleplayer, Parkour, Atmospheric, Dark, Open World, Third-Person Shooter, Shooter, Horror, FPS, Platformer, Action-Adventure, Story Rich, Survival Horror, First-Person, Stealth",66
628290,All Walls Must Fall - A Tech-Noir Tactics Game,"Feb 23, 2018",0.0,"['English', 'Portuguese - Brazil', 'Spanish - Spain', 'Simplified Chinese', 'Russian', 'German', 'French', 'Polish']",inbetweengames,inbetweengames,"Single-player, Steam Achievements, Steam Trading Cards, Steam Cloud, Stats, Steam Leaderboards","Indie, RPG","Tactical RPG, Turn-Based Tactics, Turn-Based Strategy, Strategy, 2.5D, Rogue-like, RPG, Isometric, Noir, Alternate History, Story Rich, Singleplayer, Cyberpunk, Cold War, LGBTQ+, Bullet Time, Procedural Generation, Turn-Based Combat, Time Manipulation, Perma Death",72
809280,Grimmwood - They Come at Night,"Aug 2, 2018",0.0,"['English', 'French', 'Spanish - Spain', 'Bulgarian', 'German', 'Simplified Chinese', 'Russian', 'Ukrainian']",Big Moustache Games,Headup Publishing,"Multi-player, PvP, Online PvP, Co-op, Online Co-op, Steam Achievements, Steam Trading Cards, Family Sharing","Simulation, Strategy","Strategy, Simulation, Multiplayer, Fantasy, RPG, Perma Death, Atmospheric, Indie, Rogue-like, Survival",73
24200,DC Universe™ Online,"Nov 2, 2011",0.0,['English'],Dimensional Ink Games,Daybreak Game Company,"Multi-player, MMO, PvP, Online PvP, Co-op, Online Co-op, Cross-Platform Multiplayer, Steam Achievements, Partial Controller Support","Action, Adventure, Massively Multiplayer, RPG, Free To Play","Free to Play, Superhero, MMORPG, Massively Multiplayer, Character Customization, Action, Comic Book, RPG, Multiplayer, Adventure, Controller, Third Person, Open World, Combat, Beat 'em up, Exploration, PvP, Online Co-Op, Fighting, Co-op",72
396280,Anarchy Online,"Feb 22, 2017",0.0,['English'],Funcom,Funcom,"Single-player, Multi-player, MMO, In-App Purchases","Action, Adventure, Free To Play, Massively Multiplayer, RPG, Strategy","Free to Play, Massively Multiplayer, RPG, Sci-fi, MMORPG, Adventure, Action, Open World, Strategy, Multiplayer, Cyberpunk, Futuristic, Character Customization, Co-op, Atmospheric",72
260309,Company of Heroes 2 - The Western Front Armies,"Jun 23, 2014",0.0,"['Czech', 'English', 'French', 'German', 'Italian', 'Polish', 'Russian', 'Spanish - Spain']","Relic Entertainment, Feral Interactive (Mac), Feral Interactive (Linux)","SEGA, Feral Interactive (Mac), Feral Interactive (Linux)","Multi-player, Steam Achievements, Steam Workshop, Steam Cloud, Stats, Includes level editor, Family Sharing",Strategy,"Strategy, World War II, RTS, Multiplayer, Tactical, Historical, War, Military, Action, Singleplayer, Adventure, Realistic, Free to Play, FPS",80
107600,Waves,"Nov 16, 2011",0.0,['English'],Squid In A Box Ltd,Squid In A Box Ltd,"Single-player, Steam Achievements, Full controller support, Steam Trading Cards, Steam Cloud, Stats, Steam Leaderboards","Action, Indie","Bullet Hell, Shoot 'Em Up, Twin Stick Shooter, Shooter, Arcade, Top-Down, Bullet Time, Cyberpunk, Time Manipulation, Action, Colorful, Abstract, Score Attack, Psychedelic, Retro, Singleplayer, Great Soundtrack, Fast-Paced, Arena Shooter, 2D",82
242570,Space Hulk,"Aug 15, 2013",0.0,"['English', 'French', 'Italian', 'German', 'Spanish - Spain', 'Russian']",Full Control Studios,Full Control,"Single-player, Multi-player, Cross-Platform Multiplayer, Steam Achievements, Steam Trading Cards, Family Sharing","Indie, Strategy","Warhammer 40K, Strategy, Turn-Based, Board Game, Games Workshop, Turn-Based Strategy, Sci-fi, Indie, Tactical, Singleplayer, Multiplayer, Turn-Based Tactics, Tabletop",58
22350,BRINK,"May 9, 2011",0.0,"['English', 'French', 'German', 'Italian', 'Spanish - Spain']",Splash Damage,Bethesda Softworks,"Single-player, Multi-player, Co-op, Steam Achievements, Steam Cloud, Steam Leaderboards","Action, Free To Play","FPS, Action, Multiplayer, Parkour, Shooter, Character Customization, Free to Play, Class-Based, Co-op, Singleplayer, First-Person, Gun Customization, Team-Based, Online Co-Op, Sci-fi, Tactical, Atmospheric, Adventure, Casual, Open World",70
353580,Rad Rodgers: World One,"Dec 1, 2016",0.0,['English'],Slipgate Ironworks™,"HandyGames, 3D Realms","Single-player, Steam Achievements, Full controller support, Steam Cloud, Family Sharing","Action, Adventure, Indie","Adventure, Action, Indie, Platformer, Singleplayer",72
22360,BRINK,"May 9, 2011",0.0,"['English', 'French', 'German', 'Italian', 'Spanish - Spain']",Splash Damage,Bethesda Softworks,"Single-player, Multi-player, Co-op, Steam Achievements, Steam Cloud, Steam Leaderboards","Action, Free To Play","FPS, Action, Multiplayer, Parkour, Shooter, Character Customization, Free to Play, Class-Based, Co-op, Singleplayer, First-Person, Gun Customization, Team-Based, Online Co-Op, Sci-fi, Tactical, Atmospheric, Open World, Casual, Adventure",70
200390,Oil Rush,"Jan 25, 2012",0.0,"['English', 'Russian', 'German']",Unigine Corp.,Unigine Corp.,"Single-player, Multi-player, PvP, Online PvP, LAN PvP, Cross-Platform Multiplayer, Steam Achievements, Steam Cloud, Stats, Steam Leaderboards","Indie, Strategy","Strategy, Indie, RTS, Tower Defense, Dystopian , Naval, Singleplayer, Post-apocalyptic, Multiplayer",67
872200,Rogue Company,"Jul 20, 2021",0.0,"['English', 'French', 'German', 'Japanese', 'Portuguese - Brazil', 'Russian', 'Simplified Chinese', 'Spanish - Latin America']",First Watch Games,Hi-Rez Studios,"Multi-player, PvP, Online PvP, Co-op, Online Co-op, Cross-Platform Multiplayer, Steam Achievements, Full controller support, In-App Purchases","Action, Free To Play",,75
254300,Dofus,"Nov 15, 2016",0.0,"['English', 'French', 'German', 'Spanish - Spain', 'Portuguese - Brazil', 'Italian']",Ankama Studio,Ankama Games,"Multi-player, MMO, PvP, Online PvP, Co-op, Online Co-op, In-App Purchases, Family Sharing","Adventure, Massively Multiplayer, RPG, Strategy","RPG, Massively Multiplayer, Strategy, Adventure, MMORPG, Anime, Turn-Based, Turn-Based Tactics, Free to Play",72
702600,Indygo,"Oct 24, 2017",0.0,"['English', 'French', 'Italian', 'German', 'Spanish - Spain', 'Polish', 'Russian']",Pigmentum Game Studio,,"Single-player, Steam Achievements, Family Sharing","Adventure, Indie","Adventure, Indie, Story Rich, Visual Novel, Great Soundtrack, Point & Click",70
212160,Vindictus,"Jun 22, 2012",0.0,['English'],NEXON,NEXON America Inc.,"Single-player, Multi-player, MMO, Co-op, Partial Controller Support","Action, Adventure, Massively Multiplayer, RPG, Free To Play","Free to Play, Hack and Slash, Massively Multiplayer, Action, MMORPG, RPG, Character Customization, Nudity, Adventure, Multiplayer, Third Person, Co-op, Action RPG, Fantasy, Open World, PvP, Singleplayer, Violent, Fast-Paced, Gore",76
460250,🔴 Circles,"Feb 17, 2017",0.0,"['English', 'French', 'Italian', 'German', 'Spanish - Spain', 'Arabic', 'Portuguese - Brazil', 'Bulgarian', 'Traditional Chinese', 'Simplified Chinese', 'Danish', 'Finnish', 'Greek', 'Hungarian', 'Japanese', 'Korean', 'Dutch', 'Norwegian', 'Ukrainian', 'Polish', 'Portuguese - Portugal', 'Romanian', 'Russian', 'Thai', 'Czech', 'Turkish', 'Swedish']",Jeroen Wimmers,Jeroen Wimmers,"Single-player, Steam Achievements, Steam Cloud","Casual, Indie","Experimental, Minimalist, Abstract, Relaxing, Puzzle, Experience, Mouse only, Atmospheric, Colorful, Indie, Casual, Beautiful, Free to Play",76
834530,Yakuza Kiwami (Legacy),"Feb 19, 2019",0.0,"['English', 'Japanese']",Ryu Ga Gotoku Studio,SEGA,"Single-player, Multi-player, Steam Achievements, Full controller support, Steam Trading Cards, Steam Cloud, Remote Play on Tablet, Remote Play on TV, Family Sharing","Action, Adventure, RPG","Action, Story Rich, Adventure, Beat 'em up, RPG, Open World, Crime, Singleplayer, Great Soundtrack, Violent, Minigames, Drama, Comedy, Third Person, Sexual Content, Remake, Atmospheric, Funny, JRPG, Anime",80
326160,Shroud of the Avatar: Forsaken Virtues,"Mar 27, 2018",0.0,['English'],Catnip Games,Catnip Games,"Single-player, Multi-player, MMO, PvP, Online PvP, Co-op, Online Co-op, Cross-Platform Multiplayer, Steam Achievements, Steam Trading Cards","Adventure, Free To Play, Massively Multiplayer, RPG","RPG, Massively Multiplayer, Adventure, MMORPG, Sandbox, Free to Play, Fantasy, Medieval, Crafting, Deckbuilding, PvE, PvP, Co-op, Open World, Singleplayer, Multiplayer, Dragons, Action, Action RPG, Story Rich",58
232770,POSTAL,"Nov 14, 1997",0.0,['English'],Running With Scissors,Running With Scissors,"Single-player, Steam Achievements, Full controller support, Steam Trading Cards, Family Sharing","Action, Indie","Horror, Villain Protagonist, Psychological Horror, Top-Down Shooter, Shooter, Twin Stick Shooter, Isometric, Difficult, Dark Humor, Top-Down, Dark Comedy, Surreal, Action, 1990's, Psychological, Atmospheric, Linear, Hand-drawn, Comedy, Level Editor",56
31290,Back to the Future: The Game,"Dec 23, 2010",0.0,"['English', 'German']",Telltale Games,Telltale Games,"Single-player, Family Sharing",Adventure,"Adventure, Point & Click, Puzzle, Comedy, Funny, Singleplayer, Time Travel, Episodic, Story Rich, Retro, Classic, Cult Classic, Sci-fi, Escape Room, Third Person",74
320840,Wings! Remastered Edition,"Oct 17, 2014",0.0,"['English', 'French', 'Italian', 'German', 'Spanish - Spain', 'Russian', 'Polish']",Cinemaware,Starbreeze Publishing AB,"Single-player, Steam Achievements, Steam Trading Cards, Partial Controller Support, Family Sharing","Action, Simulation","Simulation, Action, World War I, Flight, Classic, Remake, Retro, Singleplayer",61
24790,Command & Conquer 3 Tiberium Wars™,"Nov 13, 2009",0.0,"['Dutch', 'English', 'French', 'German', 'Italian', 'Polish', 'Russian', 'Spanish - Spain', 'Swedish', 'Hungarian', 'Czech', 'Korean', 'Simplified Chinese', 'Thai', 'Traditional Chinese']",EA Los Angeles,Electronic Arts,"Single-player, Steam Workshop, Steam Cloud, Includes level editor, Family Sharing","Action, Strategy","Family Friendly, Level Editor, Strategy, RTS, Action, Multiplayer, Singleplayer, Action RTS, City Builder, Base-Building, Sci-fi, FMV, Atmospheric, Post-apocalyptic, War, Story Rich, Futuristic, Aliens, Classic, Great Soundtrack",85
9900,Star Trek Online,"Jan 31, 2012",0.0,"['English', 'French', 'German']",Cryptic Studios,Arc Games,"Multi-player, MMO, Co-op, Full controller support, In-App Purchases","Massively Multiplayer, RPG, Free To Play","Free to Play, Sci-fi, Massively Multiplayer, Space, MMORPG, RPG, Open World, Multiplayer, Character Customization, Action, Third Person, Adventure, Singleplayer, PvE, Online Co-Op, Co-op, PvP, Strategy, Action RPG, Tactical",66
743860,Wild West Online,"May 10, 2018",0.0,"['English', 'French', 'Italian', 'German', 'Spanish - Spain', 'Polish', 'Portuguese - Portugal', 'Portuguese - Brazil', 'Russian', 'Simplified Chinese']",WWO Partners Ltd,WWO Partners Ltd,"Multi-player, MMO, Online PvP, Online Co-op, Steam Achievements, In-App Purchases, Partial Controller Support, Family Sharing","Action, Indie, Massively Multiplayer, RPG","Action, Massively Multiplayer, RPG, Western, Indie, Open World, Violent, PvP",29
333930,Dirty Bomb®,"Jun 2, 2015",0.0,"['English', 'French', 'German', 'Portuguese - Brazil', 'Russian', 'Simplified Chinese']",Splash Damage,Warchest Ltd.,"Multi-player, PvP, Online PvP, Steam Achievements, Steam Trading Cards, In-App Purchases, Camera Comfort, Custom Volume Controls, Playable without Timed Input, Stereo Sound, Subtitle Options, Surround Sound","Action, Free To Play","Hero Shooter, Free to Play, FPS, Multiplayer, Shooter, Action, Team-Based, First-Person, Fast-Paced, Co-op, PvP, Class-Based, Competitive, Massively Multiplayer, Parkour, Post-apocalyptic, Controller, Singleplayer, Open World, Gore",63
504370,Battlerite,"Nov 8, 2017",0.0,"['English', 'French', 'Italian', 'German', 'Spanish - Spain', 'Russian', 'Portuguese - Brazil', 'Simplified Chinese', 'Korean', 'Turkish', 'Japanese']",Stunlock Studios,Stunlock Studios,"Single-player, Multi-player, PvP, Online PvP, In-App Purchases, Steam Cloud","Action, Free To Play","PvP, Multiplayer, MOBA, Competitive, Action, Free to Play, Arena Shooter, Fast-Paced, Team-Based, Fighting, Top-Down, Early Access, Strategy, e-sports, Difficult, Great Soundtrack, RPG, Top-Down Shooter, Hack and Slash, Atmospheric",85
8500,EVE Online,"Dec 15, 2010",0.0,"['English', 'German', 'Russian', 'French', 'Korean', 'Japanese', 'Spanish - Spain', 'Simplified Chinese']",CCP,CCP,"Multi-player, MMO, PvP, Online PvP, Co-op, Online Co-op, Steam Trading Cards, Adjustable Text Size, Color Alternatives, Custom Volume Controls, Stereo Sound, Surround Sound","Action, Massively Multiplayer, RPG, Strategy, Free To Play","Space, Free to Play, Massively Multiplayer, Open World, Multiplayer, RPG, Economy, Sci-fi, Sandbox, PvP, Strategy, Action, Character Customization, MMORPG, Spaceships, Exploration, War, PvE, Politics, Lore-Rich",88
50640,Darksiders™,"Sep 23, 2010",0.0,"['English', 'French', 'German', 'Italian', 'Spanish - Spain', 'Czech', 'Japanese', 'Polish', 'Russian']",Vigil Games,THQ Nordic,"Single-player, Steam Achievements, Partial Controller Support, Steam Cloud, Family Sharing","Action, Adventure","Action, Adventure, Hack and Slash, Third Person, Singleplayer, Post-apocalyptic, Fantasy, Controller, Action RPG, Puzzle, Action-Adventure, RPG, Open World, Metroidvania, Beat 'em up, Gore, Spectacle fighter, 3D Platformer, Character Action Game, Platformer",83
73060,Defenders of Ardania,"Mar 14, 2012",0.0,"['English', 'French', 'German', 'Italian', 'Spanish - Spain']",Most Wanted Entertainment,Paradox Interactive,"Single-player, Multi-player, Family Sharing",Strategy,"Tower Defense, Strategy, Fantasy",58
1121560,Atelier Ryza: Ever Darkness & the Secret Hideout,"Oct 28, 2019",0.0,"['English', 'Simplified Chinese', 'Traditional Chinese', 'Japanese']","KOEI TECMO GAMES CO., LTD.","KOEI TECMO GAMES CO., LTD.","Single-player, Steam Achievements, Partial Controller Support, Steam Cloud, Remote Play on Tablet, Family Sharing",RPG,"JRPG, Exploration, Crafting, Collectathon, Turn-Based, Female Protagonist, RPG, Cute, Anime, Turn-Based Combat, Story Rich, Casual, Action, Simulation, Fantasy, Emotional, Adventure, Singleplayer, Sexual Content, Great Soundtrack",75
241540,State of Decay,"Nov 5, 2013",0.0,"['English', 'French', 'Italian', 'German', 'Spanish - Spain', 'Russian']",Undead Labs,Xbox Game Studios,"Single-player, Steam Achievements, Full controller support, Steam Leaderboards, Remote Play on TV, Family Sharing","Action, RPG, Simulation","Zombies, Survival, Open World, Action, Post-apocalyptic, RPG, Third Person, Base-Building, Singleplayer, Sandbox, Multiplayer, Simulation, Exploration, Adventure, Horror, Third-Person Shooter, Survival Horror, Co-op, Atmospheric, Indie",79
373720,Ryzom,"May 6, 2016",0.0,"['English', 'French', 'German', 'Spanish - Spain', 'Russian']",Winch Gate Property Limited,Winch Gate Property Limited,"Multi-player, MMO, PvP, Online PvP, Co-op, Online Co-op, Cross-Platform Multiplayer","Action, Adventure, Free To Play, Indie, Massively Multiplayer, RPG","MMORPG, Massively Multiplayer, Free to Play, Indie, Open World, Sandbox, Retro, Choices Matter, RPG, Fantasy, Sci-fi, Action RPG, CRPG, Multiplayer, 3D, PvE, PvP, First-Person, Third Person, Realistic",64
259470,Particulars,"Nov 19, 2014",0.0,['English'],SeeThrough Studios,SeeThrough Studios,"Single-player, Steam Achievements, Full controller support, Steam Trading Cards, Steam Cloud",Indie,"Indie, Puzzle, Physics",74
